en,ja
So you want to follow Brody?,それでブロディの監視を?
And this Cortexiphan is the reason she's been acting strangely.,様子が変だったのも コーテキシファンのせい？
"You would choose your own hours, of course, come and go as you please so long as the quota is met.",作業する時間は 君の都合でいい ノルマをこなせばね
Your arrangements you may find spoiled by the next harvest moon.,お膳立ては次の満月に 台なしになるかもしれない
You play the bass guitar Your son plays the guitar,あんたがベースを弾いて、 あんたの息子がギターを弾く
"Just make sure you come back in one piece, all right?",ちょうどあなたがすべての権利、戻って一枚で来て作りますか？
Our ancestors were physical beings.,- 我々の先祖は肉体を持っていた
"Step one, we build inventory.",まず在庫を 増やさないと
"- So, what do you think?",- これどう思う？
There's someone in the house!,誰かいるぞ！
"I'm peeling your wig back, you understand me?",かつらを引っ張って皮を剥ぐ 分かったか？
What the hell is that?,あれは何？
"Lionel, you worried about me?",心配してるのか？
- Get back! - Fall back!,退却
"This is serious shit, Darcy.",- くだらん事だ　ダーシー
You know...,もちろん...
You can't--,行けないよ...
But now that I've tasted its true power I'll never go back.,真の力を味わった 二度と戻らない
I've got it under control!,抑えた！
Very well.,よかろう
No.,行かないわ
I shouldn't.,俺には無理だ
Get your hands off me.,手を放せ 失礼しました
No medic.,手遅れだ
It's already done.,もう 遅いよ
I'm really sorry about that.,本当にすいません
I'll see you around.,またね
Monsters like you have everything. You don't have to be good.,君はモンスターの全てを持ってる 何の苦労もない
I can take him off.,彼を連れ去るぞ
"And he will do so by crying, not picking out clothing.",泣いて衣服を引っ張りまわすのよ
Three.,"""伝言3　5:"
I'm learning to sew so that I can make myself a dress.,私は自分でドレスが作れるよう裁縫を習っている。
Prev,"cpdf_set_title(), cpdf_set_creator(), cpdf_set_keywords() も参照下さい。"
"- That's the frailty of genius, John, it needs an audience.",それが天才の弱みだよ、ジョン。 観客が必要なんだ。
Not Belgium,ここはベルギーではありませんbelgium.kgm
I'm begging you.,お願いします...
"Hell, no, ain't gonna see one either.",そういうことなんだ！
The Secretary of State.,国務長官です
-l can't leave now. lt sucks!,- 今　帰れる訳無いよ！
He is always natural with other people.,彼はいつも人に打ち解けた態度をとる人だ。
Yet you would sell out your country.,それでも売るでしょう アウト貴国
Brain dead on impact.,衝撃で即死だわ
I think it's all of us.,で　月に人を送ったのは俺なんだと
And you put some netting on it so I can breathe through at night time.,その上に網を置けば 一晩中、呼吸が出来るということさ
There's a reason for that.,それには理由がある
Just do what you have to do.,やるべきことをやるんだ
"- Nothing! Do not sleep! Who can tell me, where was the last meteor rain so hard.",最近の大型隕石、分かる者は？
It's a small one.,小さいな
"Just at that time, the bus stopped.",ちょうどその時バスが止まった。
"Once we get to the show, we are talking millions.",いずれは数百万人が見る デカいレースへ出場さ 箸をお持ちしました
Konqueror Introduction,Konqueror はじめに(Q)
Some Lines in File Were Invalid,ファイル中のいくつかの行が不正です
Yes... I loved her.,愛してました
Hmm?,ん？
You make them feel lucky.,他人がラッキーな気分になる
- Is that right?,—そうなのか？
"True. Maybe not stop you, but I wouldn't like it.",（夏美）まあね 止めるっていうかイヤ
I'm not saying that you would even know how to... would you?,方法も知らずに だ... どうかな？
"I don't know, Bianca.",知らないよ　ビアンカ
Where is that Orc-filth ?,不浄なオークはどこだ？
The hell they will! No frigging way!,よう
That doesn't seem to be an option for either of us.,我々にはその選択肢がない
- Those guys were picking on kids.,いじめっ子たちから逃げたら、
"There's a time for recording history, and there's a time for making it.",歴史を記録する時間や― その為の時間もあるのに―
I admire his courage.,私は彼の勇気に感服する。
You?,あんたは?
Tolcher was working heavily from his theories.,トルチャーは彼の理論を 応用していた
Twenty leagues.,夕暮れまでに
To meet you and take you out to the lake.,[湖に案内するよう手配します］
So long New York.,またね ニューヨーク
We can go kill it before it's born.,誕生前に行って壊すことは可能よ.
I've had enough of this! I'm going to stop a car.,もうたくさんだわ 車を止めてくる
We've been here before. How does it end?,"逆らって""この前""、どうなった？"
millipascals,ミリパスカルunit synonyms for matching user input
". .. I'm afraid, once used to describe...",私は、それについての記述を 呼んだ事があるが・・
Right.,そうね
- Don't be a fool.,- バカなことはやめろ
♪ Every time I close me eyes,♪ Every time I close me eyes
I somehow doubt that.,実行すると思うか？
He told me you ditched him outside the precinct.,彼を管区の外に置いて君が逃げたと 言ってるぞ
- Now it's back to jazz on KRA - - Talk to me. Do I have to?,なんか話して
"May I offer you some wine, your holiness?",ワインを注ぎましょうか、聖下？
And Lynetta would watch them practice.,リネッタは練習を拝見
Felt good.,そう感じたんだ
Am I interrupting?,ちょっといい？
- 'Cause it seems like you do.,- そう見えるぞ
What's on the docket?,俺達は契約した
"Shane says my good intentions are making us weaker, that I can't make the hard decisions for the good of the group.",シェーンが俺は間違ってるって みんなにとって 良い判断ではないって
Not expensive clothes.,高価な服ではない
- Nobody ever listens to me. But they should.,誰も俺の言うことは 信じないけど
Happy anniversary!,記念日　おめでとう！
"Please BFG, start.",どうぞ BFG 食べて
- I lοve that sοng.,- 私も好きだ
"You're still a little grumpy about the birthday present thing,aren't you?",君は　誕生日プレゼントのことで まだちょっと不機嫌なんだ
"Jack, that's enough. You need to stop now.",ジャック　十分だろ もう止めるんだ
Your reaction to what happened is bound to be even more annoying than your reaction to not knowing.,理由B　話せば　あなたが今より もっと困ることになるから
A demon of the ancient world.,古代の悪魔じゃ
What do I do?,何をしたらいい？
Hey.,な アンタはどう思う?
Aw.,ああ、
"Oh, shit.",何という事
Why not just tell us your solution?,答えを教えて下さいよ
He's in.,成功です。
"Hey, Kiera. It's Carlos. Remember me?",キエラ 思い出せよ
"Not a scratch, Doctor.",傷をつけるな。
Are you sure you're not too rusty for all this?,この場に そぐわないとでも？
-They're not peeled yet.,-　まだ剥いてない
Ex-wives.,元妻たち
"Okay, here's what we are going to do.",わかったこうしよう
I'd hoped he might see me as a kind of father figure.,私を父親的存在と見てくれたらいいんだが
"You, who walk in here with a coin you never earned, whose value you do not respect.",自分で稼いでいないコインを持って入ってきたあなた その価値を理解してない
"Oh, my.",オォ
Have a seat.,座って
I have lost a lot of blood.,血の気が　抜けちまった。
There aren't any Taliban here. They're regular civilians.,タリバンはここに居ない 彼らは民間人だ
Go!,行け!
Look out!,注意して！
"Actually, I was rather hoping to take a look at the crime scene.",実は　犯行現場を 見たいと思ってたの
Steve!,スティーブ
"Now, if you wanna look like even bigger idiots, why not open it?",あれ？ 何だ？
And my heart is really aching!,心が真に痛みます！
Now I'll steal something from her.,だから 私も 彼女から盗む
"""Chow.""","""チャウ"""
Holy shit! Faster!,なんて事だ！
Very.,まさしく
Check this option if you do not want the icons to be moveable in the view. This option is useful if you want to avoid accidentally moving the icons while interacting with them.,ビューのアイコンを動かないようにするには、このオプションをチェックします。 このオプションは、アイコンを操作しているときに誤ってその位置を変えてしまうのを防ぐのに役立ちます。
I'm sorry. I can't speak.,言えない
I'm in a boot locker.,既に死んでます。
- Shall we continue indoors?,- 部屋に戻ろうか？
She's here on behalf of Delos to oversee certain transitions in our administration.,彼女は管理職の移動の件で 視察にいらしたの
I can feel it... his hesitation on the other side of that door.,室内の大統領の ためらいを感じる
Reset to default value,標準の値にリセット
System colors Here you can select colors from the KDE icon palette,システム色 KDE アイコンパレットから色を選ぶことができます。
"On September 7th, I wrote you:",９月７日に書いたよね
Telegram for Mrs. Watson.,ワトソン夫人に電報です
"Sorry, I...",ごめんなさい
Timiş oara,ティミショアラromania.kgm
You did what you had to do.,当たり前のことをしたんだ
"Ducky, this, uh, John Doe doesn't have a case number on it.",これ　事件番号が未記入よ
I wanted to thank you for putting in the word for me.,あなたに感謝したかった 色々と助言して貰って
You work for me now.,今は 私の為に働いて
"- Hmm, I'm getting married.",- ふーん。 俺は結婚するんだ
How the hell could she do that?,一体どうやって 彼女はこんな事した？
until D.N.A. test results are done.,身元は　わかりません
- That's right. That's it. - Yes.,いいね
"403)}Report on ""The Indirect Loan to Lafite Incident"" ""The Iseshima Hotel Insider's Tip-Off Incident Briefly.",ああ 一応はね
- Who? You need to go.,君は行くんだ
- How much longer?,- どのぐらいかかる？
I like that hotel pretty good.,1951年11月14日 ニューヨーク このホテルはいいね
"Oh, Neve...",ニーブ
II don't know what to say.,い... 言うべき言葉が 見つかりません
I will never see him again.,私はもう彼に会わないだろう。
The operation is a difficult one. 30 pennies in advance.,手術は難しいんだ 前金で30ペニーだ
"- Not for me, anyway.",心残りだ
- Why don't you tell the truth?,- 真実を言えよ
He was not aware that the praise was a satire in disguise.,その賞賛は皮肉の変装したものであることに彼は気がつかなかった。
I think I need to use the litter box.,猫用トイレが必要ね
Jim!,ジム！
- Everything is permitted.,すべてが許可されている
I think...,思いついたんだ
"- Oh, God, I'm sorry!",- ああ、ごめん！
Thanks. Have a good night.,ごちそうさま いい夜を
Forget it!,忘れてくれ！
That's why you have to be there.,だからこそ いるべきなんだ
"No, really.",いや 本当につくづく思う
I have a secret to tell you.,あなたに言わなくちゃ いけないことがあるの
"I designed the machine to detect acts of terror, but it sees everything...",テロ行為を検出する為に 私が開発した マシンは全て見ている
Whoa!,ワォ！
"- Tonight, 6 o'clock.",今夜、6: 00
Get over here.,こっちきなさい
I'll give it one more try tomorrow.,明日　もう1度やってみる
Output of %1,出力ファイル:
Hey. Ben. Russel.,よおベン・ラッセルだ
Try to feel his next movement.,次の動きを予測
Open Sesame.,ドアが開く
That means he jumped on his own.,ということは　被害者は　自分で飛び込んだ
"And as for our investments, the council never lost a dime.",私達の投資に関して　評議会は １セントたりとも損失は無いし
You son of a bitch appendix!,ヤリチンめ！
"Yes, green!",はい、緑！
"Is it harder to create you or the heaven? But Allah built it,",あなたがたは（かれが）うち建てられた天（の創造）が，あなたがたを創ることより難しいとでも思うのか。
Mikhails broder?,売春にクスリ 武器の売買
Ohh! (Laughs) Nice!,上等だ
"One would have thought that anti-Semitism died forever with the Holocaust; but it did not. There are those who deny that the Holocaust ever took place, or that it did in its all-too-well-documented manner.",反ユダヤ主義はホロコーストと共に滅び去ったと思われていたかもしれないが、そうではない。ホロコーストははじめから無かったと主張する者や、巧妙な文書の上で事実化されたものだとする者もいる。
He was warded when April found him.,遮蔽してても エイプリルに見つかった
♪ Yeah,♪ Yeah
"God damn it, wait for me.",くそ ちょっと待って
He's strong as iron. Such men don't die.,鋼みたいに強い人よ 死ぬ筈が無い
"Yes, he was.",そうね
Your majesty.,陛下。
They're alive. My wife and son.,妻と息子はきっと生きている
"With a little, additional oversight.",多少監視の目は厳しくなるが
I should have a birthday more often.,誕生日なら毎月でも良い
He knows a lot.,彼は　物事をよく知ってるけど
"The bears in the north and the foxes of the south, all the birds in the sky and the beasts in the sea--",北の熊も南の狐も　空の鳥も　海の獣も全て―
"Yeah,the whole plane.",機内のな
"What a, what do you call it, a poetic turn of events.",言うなれば、 災い転じて、福となる
"No hiding, no waiting. You keep going.",隠れたりせず　進み続けろ
"Full citizenship for myself. Well, that goes without saying.",完全な合衆国の市民権、 これは言うまでもありませんな。
Maybe you were tempted To leave a note.,恐らく書き置きも？
"Yeah, I get both sides.",（ｱﾙﾏﾝ）俺も両方の側も分かる
What do you think?,どう思います？
"-lt's not just your father, Jesse.",父さんは悪くない
By bodybuilders.,ボディビルダーに
- Huh! Can't leave you alone for a minute?,- 1分位　一人で居られないの？
"They know our names, our faces.",- 行くの？
"Convince Klaus to help us, and no one has to know about the newest member of the original family.",私たちを助けるために クラウスを説得するのよ そしてこのことは 一切他言無用 他のオリジナル家族にはね
Who told that to you?,どうしてそのことを知っているの
The only thing that's gonna help them is more Cipro.,助けるのに 必要なのはシプロだけよ
"I said, ""She forgives you for the pendant. """,言ったでしょう 「ペンダントのこと 彼女は あなたを許すと言ってる」と
"I figured if I went through with it, I could call in an anonymous tip, tell the police about who Anne really was, and she'd get the blame.",それで主人を殺して 警察に匿名で アンの正体を密告すれば 彼女が疑われる
Beers.,ビールに
"Oh, yes.",ああ　そうだな
"The stakes are much clearer than they usually are in thesetypes of battles. Mittal has an obvious interest in gaining controlof Arcelor in order to improve its global geographic balance, boostits market share in high-end steel products, and reduce itsvulnerability to the speculative jolts that occur in the raw steelmarket.",利害関係は、このタイプの戦いにおける通常のものよりも、ずっと明らかである。ミタルはアルセロルの支配権を握ることに明白な興味がある。それは、世界地理上のバランスを改善し、ハイエンドの鋼製品の市場に占めるシェアを増大し、そして、鋼鉄市場で起こる投機的なショックに対する弱さを減らすためである。
I'm the one who decides what's best for the crew.,クルーにとって何が最善か 判断するのは私の役目だ
I don't know the details.,"""詳細は不明だ"""
"Toby! Throw it back here, brother. We need you.",トビー お前も手を出せ
"Now our agents believe that this man may be connected to dozens of unsolved homicides and assaults over the years, many of them here in New York in the last six months.",我々はこの男が ここ数年の未解決殺人などに 関ってるに違いないと ここNYでもこの６ヶ月で
"All right, fine, just w-, just give me a second, all right?",マシンは成功した　ベン 一緒に来て欲しい 今？
Don't worry.,気にしないで
"And glorify Him for some portion of the night, and additional adorations.",また夜も，かれを讃えて唱念しなさい，また礼拝の終りにも。
Don't be angry with Dad.,お父さんに怒らないで
You'll be summoned to appear before the High Command... to account for your actions.,自分の行為の説明のために 最高司令部に召喚されるだろう
"What are they saying, Finch?",彼らは何を言ってる　フィンチ？
Matt needs someone to take care of him.,マットには 世話して くれる人が必要だわ
I'm not the only one the FBI will be interested in.,FBIが興味を持つのは 俺だけではない
"Come on, man. This song is important to me.",さあ この歌は俺には大事なんだ
"Robby, next time give me a goddamn heads up.",次は報告しろよ
Matty!,マティー！
♪ I trace it all back to then,私はあの日に思い出す
I was surprised and unless I'm unprepared.,きなりの事で何の用意もありません
Okay. Something did feel wrong that day.,いいわ　その日は何かおかしいと思ったの
Excuse me.,聞こえなかったんですが...
"Yes, I think so.",ああ　そう思う
"And if he be of the Companions of the Right Hand,",もしかれが，右手の仲間であるならば，
Lucky night at the casino.,カジノでの幸運の一夜か
I'm Rudy.,ルディだ
Read this.,これを見て
- Why would I come out?,- 出るもんか
You can't make it better. Don't try.,- うまくいかない　やめとけ
Stay right where you are!,そこを動くな
We haven't been that lucky.,運がなかった
"- You should have let them, Jesus Christ!",- 逃がせばいいだろ
"She's no good to me in the Dark Forest, lost!",暗闇の森で失った？ それでは済まないのよ
That's the one. I prefer him.,そう　彼がいい
I said stop!,動かないで！
I sold the books.,私は本を売った。
So you live around here or what?,このあたりに住んでる？
She does have to take my advice now.,彼女は今、 私の助言を聞くはずよ。
Your family knows you're safe.,無事は伝えたわ
- Calm down!,- 落ち着け！
But I consider you a friend.,友人でいたいと思っている
"Buddy, anything I can do for you is aces by me.",俺は機械はいじれないです
Because you already have been...,何年も前から
What do you people want anyway?,何がしたいんだ？
Morning.,おはよう
"It was ""qwerty.""",クワーティです
- Feds?,- 連邦警察は？
"What you think, this is a joke, Josh?",これはお遊びか？
- Unbelievable!,- 信じられないわ
(SIGHS),（ため息）
"Yeah, Captain pulled some strings with the commissioner.",現場に戻ったのね？ ああ　警部が警視総監に口添えしてくれた
"He was conspiring with Sherrington, not Mycroft.",その後　シェリントンが
"I'm not happy where this conversation is going, Frank.",話が不穏だな
One degree up bubble. Depth ten meters.,潜舵角 １度アップ 深度１０
You can't even say what it was in the first place.,どうして分るの？ そもそも 何だったのかも分らないのに
"Okay, now it's my turn.",- 今度は私の番よ - 何のさ？
It was Gordon Way.,ゴードン・ウェイだった
- [phone rings] [phone buzzing],- [電話の鳴き声] [電話のブザー音]
Why are you doing this?,どうして こんな...
The horse.,何だって？
Slade. Please.,スレイド...
- like some sort of ghost.,ある種の幽霊のように
Bolt?,ボルト？
"I know this girl, her name is Aleya.",この少女を知ってる 彼女の名前はアリア
Well that's just fantastic!,感動だよね　泣けるわ
The blood splatter patterns and trajectory of the remains... only a high-speed collision could have done this.,血の跳ねたパターンと 軌道の跡からー 何かが高速で衝突したようだ
I'm allergic to is you.,お前だよ
That was me knocking your ass to the dirt with your own hand.,？ 尻もちつかせてやったのさ あんたの手でな
"Well, I wanted to be here. So?",あぁ　ここにいたくて
This is how grateful I am. I'm going to give you the last of my muffin.,お礼に　マフィンの残りをあげるわ
Yeah. And New Year's.,新年よ
You saw him.,あなたは あの子の姿を見た
You must move quickly.,捕まりたくなきゃ 急ぎな
"You know, to tell you the truth, I don't understand you either.",どっちもよく分からん
"Anywhere else on the planet, this species lives a dozen years, at most.",世界中のどこでも この種の寿命は12年ほどだが
Derek... is a selfish jerk.,デレク... 利己的な反射をしています。
"The Day whereon ye behold it, every suckling woman shall forget that which she suckleth, and every burthened woman shall lay down her burthen; and thou shalt behold mankind as drunken, whereas drunken they will be not, but the torment of Allah shall be severe.",その日あなたがたは見るだろう。凡ての哺乳する者は，哺乳することを忘れ，凡ての妊婦はその胎児を流し，また人びとは酔わないのに，酔いしれたように見えよう。思うに，アッラーの懲罰が厳しいからである。
"Come on, move it!",さっさと歩け！
- Different sizes.,- 違う大きさ･･･
Projects stored in a file,ファイルに保存されているプロジェクト
And now they're framing us for the assault of Anna's kid.,アンナの娘っ子をやったのが 俺かパーカーかと
How much did you find?,どのくらい見つかったの？
It began to rain cats and dogs.,雨が土砂降りに降り始めた。
"ls it that your body is too massive... for your teeny- tiny head... or is it that your head is too teeny- tiny... for your big, fat body?",とても 小さな オツム の ため か な ？
"Margot, please.",マーゴット、お願いします。
"Media got a hold of the program name, which means your old boss control just lost it.",マスコミは プログラム名を入手した すなわち　君の昔の ボスは支配力を失った
You cannot get blood out of a stone.,ない袖は振れない。
"Backstreet was the only legitimate boy band that ever came out of Florida, period.",バックストリートはフロリダから出た 唯一まともなグループだぞ
"You shot my baby, daddy!",アイツが殺したの！
Looks like we'll need a change of venue.,会場の変更をする 必要があるようだ
Doesn't sound so bad to me.,悪い気はしませんね
"Come on, start pounding out a lead.",- 望みは？ - 君が知る全てだ
That has come on in the last few years. He's one of the best.,この何年かで 最高の選手でしょう
"Tomorrow, they are taking me to the authorities, who will house me in something that is not an orphanage, but still doesn't sound like the sort of home we were really hoping for.",明日僕は当局に 連れていかれます 孤児院ではなく どこか収容先を探してくれる でも普通の家庭であればと 心から願います
But the young lady want s only four.,ね 12人だよ 最近のお嬢さんは2人でも十分なのに4人よ
All right.,はいよ
We didn't even know Where to find that idiot!,居場所も分らんのだぞ！
"- The fire, it's at the dairy farm. - Mitchell's?",酪農場で火事よ ミッチェルのところ？
It'll all fit.,これでいい
You and your fucking lies,嘘ばかりこくな
- I told them where we are!,- ここにいるって知らせた
"If Natsu marries Ando-san, then it will make ""Andonatsu"", won't it?",奈津さんが安藤さんと結婚したら、「あんどうなつ」になっちゃうんだよね。
Unfortunately please,残念ですが お願いします
Let go of my...,-腕を...
"Yeah, yeah, sure. I can...",あぁ　いいとも
Drink. You will have a taste of my power.,飲め　力の味覚を味わうのだ
"And some black licorice, Jeremy!",グミも頼む ジェレミー
So unfair.,卑怯だな
Then this gentlemen will kill you both.,その後　この人達が 君らを殺すだろう
"Jonny Wu says it's all about seeing the humor in the chaos, right? Right?","ウーが言ってた ""混乱を楽しめ"""
I've just been enjoying the view.,景色を楽しんでるところよ
"Oh, fuck.",Fuck
