en,ja
He replied: 'Allah will bring it (down) upon you if He will; you will never frustrate Him.,かれは言った。「アッラーの御心があれば，かれだけがあなたがたにそれを現出されるであろう。あなたがたは（それを）避けられないのである。
God willing we see your children or we die?,神様は子供を見せてくれる考えか それとも私たちが死ぬか?
"Mrs. Altmann, it would seem that if your case goes forward, world diplomacy will collapse, and you will be solely responsible.",あなたの訴訟の 審理が進めば 対外外交は崩壊して その全責任は あなたにある
"I was trying to help. I wanted to get to a car, draw them away.","{a1pos(118,268)} 役に立ちたくて 車を取りに行こうと"
"For what we are about to receive, may the Lord make us truly thankful, and may we always be mindful of the needs of others.",主よ　食事の恵みを お与えてくださり感謝します みなの心と身体を支える 糧としてください
Shut up and calm down.,黙って、落ち着いて。
Go on in.,行ってくれ
You stay here with the wounded and guard the prisoners.,あんたは負傷者とここに留まってくれ 囚人を守って欲しい
"For my spoiled-brat, car-wash-millionaire nephew?",ｗ
"I wanted to stop by, see that you're good.",パパが元気か見たくて 立ち寄ったの
She is missing a few drive decoys and EPS conduits are fried... but Jaylah has done a marvelous job getting the ship systems back online.,幾つかのドライブコイルや EPSコンジットは焼けてるけど ジェイラの驚くべき仕事で システムは復活出来ている
"Even if I did, there's one thing you got to remember.",調整弁にするつもりだろ そうだとしても　これだけは 忘れるな
Problem solved.,- 問題解決ね
No.,いや
A companion for a child who has outgrown you.,もう、お前など必要ない
What's this?,何だいこれは？
Now where is Gerry?,ジェリーはどこ？
"- The telegram, wasn't it clear?",- 電報見ました？
She's mad at you? Mm-hmm. Oh.,お前に怒ってるって？ 彼女はわざと あなたを凌駕したのよ
What are you?,正気か！
[Sighs] Claudia wasn't pregnant.,クラウディアは妊娠していませんでした
I destroyed the others.,他は全て処分した
You are more than welcome to have a party or whatever in this room!,パーティーでもなんでも やっちゃってください！
Locate in KMail,KMailに配置@info:whatsthis
Hostname/ IP address for ping test,ping テストに使用する IP アドレス
Come on. Let's go!,さあ　行くぞ！
"Hey, now, don't do that.",おい　ダメだって
The peace endures.,平和の存続を
This is Irving. Irving.,こちらはアーヴィン アーヴィン.
"Eh, Gromit?",グルミット君、あのさ...
I swore to protect you I made the Unbreakable Vow,"君を守ると""破れぬ誓い""を立てたのだ"
"If there is anything to make you wonder, it would be the words of those who say, ""When we become dust, shall we be brought back to life again?"" They are disbelievers in their Lord and will wear heavy fetters around their necks. They are the dwellers of the hell fire wherein they will live forever.",もしあなたが不思議に思うのなら，「わたしたちが（現実に）土になった時，わたしたちは本当に新しく創造されるであろうか。」とかれらの言うことこそ不思議である。これらは主を信じない者である。かれらはその首に枷がかけられる火獄の仲間で，その中に永遠に住む者である。
You just don't look like an engineer.,エンジニアに見えなかったから
Is that right?,これでいい？
The matter is all settled.,その問題はすべて解決済みだ。
Ray?,レイ
I don't believe I've ever seen anything more beautiful.,それは何よりも美しかったんだ
She's the one with all the degrees.,彼女は学者だから
So whoever stole the list has already decrypted it.,リストを奪った奴を 解読したの
"Oh, come on, you guys. A lady never talks.",レディが こんな下品な 言葉を
- dexter.,デクスター？
And that was that.,だからよ
"Captain Hernandez, please direct your weapons at the battle cruiser.",- ヘルナンデス船長、戦闘機への攻撃をお願いします
Why are they sending you back to the States?,なぜ彼らは送信している あなたが米国にバックアップ？
"We have set in heaven constellations and decked them out fair to the beholders,",われは天に星座を定めて見る者に美しく眺めさせ，
Catch!,持ってろ。
I look.,それを見て
Kenneth Wesley Wimer II,Kenneth Wesley Wimer II
"Five, four, three, two, one.",5・4・3・2・1
"Yeah, a woman did once.",ああ　昔　ある女に言われたよ
What are you talking about?,君は何の話をしているのですか。
Sends you a couple of joke texts?,イタズラだよ
Incoming!,来た!
Can you do that?,できるかしら？
"We will evacuate the villages, but we will bring war to them in the Wilds, wherever they may be.",村からは撤退する 荒野で戦いを挑もう どこへ来ようとも
"New work in progress, chapter 1.",進行中の新作　第一章
"- I bet he calls you every night when he's away, doesn't he?",いない日はいつも 彼があなた電話を？
"The higher up you go, the harder it gets to tell the good guys from the bad.",上に行けば行くほど 善悪の見分けが難しくなる
I'll take that bet.,その掛けに勝つよ
"Well, just don't get caught hanging around.",あまり長居してられないぞ
"All that talk about ""us."" ""I'm so proud of us.""","何が""僕ら""よ ""２人はチーム""よ"
You're all on your own.,みんな勝手にすればいい
My search yielded one name-,最近買った人物を聞き出した その結果わかった名前が　ヴァネッサ・ヒスキー
He's a close friend of mine.,彼は僕の親友だ。
"Hey, let's take a walk, shall we?",歩こうぜ？
No lumps.,なめらかに
"And I tried, you know.",できる事は全て 彼女の求める様に
"Sorry, instructor.",済みません　指導員
I bet you do.,私はあなたを行うに違いない。
A purpose.,生きがいと。
I'm sorry.,すまなかった
What did Moses do to earn a lethal finding?,奴が知る ヤバい事実とは？
- What are you doing?,- 何をしている？
Symmetrical its central body mass.,体軸に対する対称性
"I know, have you been to ""Kazemachi Dori""?",あ「風待ち通り」 行ったことある？
PUBLIC FINANCES Departmental Direction.,＜財務省＞
"- You poisoned him, you poisoned him.",- あなた彼を殺した　あなた彼を殺した
"Oh, I would argue that a lot of people don't even know what beignets are, Spackman, but I will concede you that point.",ベニエを知らない人たちと 一緒だったけど きみは知ってるんだね - とても嬉しいよ
I didn't even know what my middle initial stood for.,宗派も 犬を飼っていたか否かも 自分のミドルネームさえも
He's heading for the van!,バンに向かってる！
Got to pick up a few things.,２，３持っていくものがあるんだ。
There's not three people in the world that could've done an induction on a cop.,警官に催眠術をかけることが出来た人物って 世界に３人もいないよ
Lukas will live again.,ルーカスは生き返るわ
No one will die? Didn't you promise me,死人は出さない約束だろう
Is that why they were all looking at me that way?,それでみんな 私を笑っていたの？
Checking if my hands are pulsating.,手が動くか見てる
Cause I'm getting to the bottom of this.,真相はすでに掴んでいる
Kill them!,敵を殺せ!
I just put a BOLO out on Zoey to local police.,捜索手配をしたから
I'm dying of thirst.,のどがかわいて死にそうです。
We're down. lt's cooked.,We're down. lt's cooked.
I had a change of heart.,気が変わったの
Show me a warrant.,逮捕令状を見せてください
"- Come on, guy.",- 来なよ
"Only execute the alarm during working hours, on working days. You can specify working days and hours in the Configuration dialog.",勤務日の勤務時間中にのみアラームを実行します。 勤務日と勤務時間は設定ダイアログで指定できます。@info
And on the Last Day – that day they will all separate.,（審判の）時が到来するその日には，（凡ての人は）ちりぢりにされるであろう。
- Asshole.,- あんぽんたん.
"I'd want him to be just like your kid, which makes this so much harder.",お前の息子のような子がいい だとしたら　つらくなる
The codes have advanced more than we ever could have imagined.,想定外の進化をしたけど...
How much time before he gets here?,奴はどれぐらいで来る？
What's his problem with you?,彼とお前に どんな問題が？
"That what it cares, they are known.",サインは不要なの 有名だから
This is why she's here.,挑発に乗るな
Come on.,逃げるぞ!
- I can't do this. - You have to go.,私には出来ない もう行って
Fantastic!,すばらしい
We drop off our luggage in a small prefab hut and promptly start preparations.,俺たちは小さなプレハブ小屋の中に荷物を置き、さっそく準備をする。
Shilka here anymore. It took the men with guns. I have seen.,"""シルカ""が 奪われてしまった"
Did the message happen before or after you were sent to install extra phone lines here?,そのメッセージを受け取ったのは ここに電話線の増設に来る前？ それとも後？
I was suppose to have a baby with my ex-wife.,別れた女房と 子供を作ろうとした
♪ Walking in a winter wonderland,♪ Walking in a winter wonderland 冬の不思議の国を歩いていると
I tried dialing the numbers.,どういう意味？
- Sir.,- はい
What is that...,あれは、何...
"Speaking of which, I'm afraid your smokes were pretty much done for.",残念ながら、あなた方のの煙草は すかっりダメだったんで
SIR LANGSDALE: Careful.,気をつけろ。
"Took in a lot of smoke, but I think he's gonna pull through.",リンダが見つけたのは 運が良かった 少し煙を吸い込んでいるけど
Mr. Ikeda wants to buy a new car.,池田さんは新しい車を買いたがっています。
"Ok, that's enough.",もういいわ
"That is why today, we send him off the only way that truly makes sense... a Viking funeral.",今日、彼を送るのに 相応しい送り方、 バイキング葬儀
I'm glad Assface is not here.,アスフェイスがここにはいなくて良かった
He thought he knew something about me.,あの野郎は、違ってた。
- A little.,- 少し映ってる
"If asking's not gonna work, I won't ask.",頼みを聞いてもらえないなら もう頼まない
"2,000, Your Grace.",二千人です　陛下
Yeah. Hey.,こうやると燃えるぜ
Once you were married he was going to murder you.,結婚していたら 彼はあなたを殺すつもりだった
"Uh, I'm her, uh, sort of like Maisie's stepfather.",僕は その... メイジーの義理の父 というか
What are you doing here?,何しに来た
I told you I'd be happy to stay on and help in a... freelance capacity.,ここに留まって 自由な立場で援助したいと
She was seeing to some peace ambassador duties at the center.,平和の使者センターで勤務中でした
That message is kill him!,［・・・彼を殺して！
- Have the key.,- ないのか？
Does Hanoi know that?,ハノイ警察は 知ってるのか？
You know it'll just make things worse.,お酒は悪影響よ
And what will make you know what the striking (Hour) is?,恐れ戦く日が，何であるかをあなたに理解させるものは何か。
"What, did he ""kill a human"" or something?",まさか人間を殺した？
"And, Kim,",そしてキム
it was aging.,老衰した
I'll check with Beasley at War Assets and see if we can't find another plant.,軍用資産局のビーズリーに 当たってみる
"Well, that is my question. What have I got in my pocket?",最後の質問だ ポケットに何が入ってる？
Go home to people who care about you.,君の家族はきっと心配してる
KELLY: You'll live.,- 死んでないからよ
This is all your evidence?,それが　君の言う証拠か？
"You're gonna be okay, Ma.",. 母さん
You have to teach me that one.,教わりたいくらいだ
Security through obscurity.,曖昧さが生む鉄壁の防御
I'll expect a full report as soon as you're done.,完了したら、すぐに報告してくれ
"""They are heading straight towards us on highway 10.""",国道１０号を 真っ直ぐにこっちに向かってる
"And there is none of us but has an assigned place,",（整列している者たちが言う。）「わたしたちは各々定めの部署を持っています。
Hal...,ハル...
"I got the freakin' fever. I'm burning up, man.",熱が出てる 燃えそうだ
"There's nothing to be nervous about, Cynthia.",- 怖がることはない
You did. You killed me.,止めただろ　僕を殺した
- As you made sure you had a real cool,本当にクールだった -ガボットさん
- Oh. Mum!,- ちょっとママ！
"Pa, it was a joke.",パパ　ただの冗談よ
I know you're not looking for anything serious but I like you Reggie and if all we can be is good friends I'll take it.,カレ氏を探してないのは分かってる でもレジー 好きなんだ 友達だけでもいい
I'm pregnant.,妊娠したの
They need you back at the office.,オフィスに戻ってくれ
Wow.,へぇー
"I'm sensing nothing, so if he's here, he's warded up to the gills.",何も感じない もし彼が居るのなら 恋人から隠れているんだろう
"Like in the 17th century, royal foresters used them,",元々は17世紀に 王の森の番人が使った
I've questioned a few embezzlers and some identity thieves.,横領者と ID泥棒に質問した
[Doc] What did you do?,どうなった？
You have instincts.,君の本能が知らせてるんだ
My mother taught it to me.,僕の母さんが　教えてくれた。
Unable to remove the program: the program is global and can only be removed by the system administrator.,プログラムを削除できません: このプログラムはシステム全体のもので、削除できるのは管理者だけです。
Of The Flash?,フラッシュを？
Gars am Inn,Gars am InnCity in Germany
Any luck?,.
Skip updating files that already exist on the receiving side (--ignore-existing). Existing directories are not ignored.,転送先で既に存在するファイルのアップデートを行いません (--ignore-existing)。既存のディレクトリは無視されません。
Take it off.,脱ぐんだ
"Oh, no!",どうしよう？
Help! Help me!,助けて！
"Six hundred and sixty-five gallons, that's 9,975,000.","665ガロンで、9, 975,000だ"
This function is EXPERIMENTAL.,(PHP 4 = 4.1.0)
"Well. Actually, I...",いや そんな...
For our species?,私達の未来 私達の種にとって
"Oh, God. Why are you doing this?",もう・・・どうしてこんなことするの？
Neutral?,いい加減？
All right.,・・わかった
Take him to the holding cell.,拘置場に連れていけ。
"- Hey. - Not a good time, Quinn.",おい 今はまずい
I can't take it anymore. I don't wanna be quiet.,誰にも出来ない 静かにしなくちゃ
-Garces!,-ガルケス!
Uh-huh. And did you know that they have six zombies. Six!,そうよ　しかも６体もゾンビがいるのよ ６体も！
At least something is.,他のを飼ってたんだろ
Housed inside a thin silicon pouch.,シリコンの袋に入れてあった
Catch them frogs. Catch them frogs.,カエルを捕まえるんだ
"Answered (the Lord): ""They shall wake up repenting soon.""",かれは仰せられた。「暫くしたら，かれらは必ず悔いるであろう。」
"But if they fail to answer you, know that it was revealed with God’s knowledge, and that there is no god but He. Will you then submit?",もしかれら（神々）があなたがた（の呼びかけ）に答えないならば，あなたがたはそれがアッラーの御知識からだけ下されたものであること，またかれの外に神はないことを知りなさい。それであなたがたは，心から服従，帰依するのか。
Maybe I could get him to open up.,私なら　彼の口を 割らせることができるかも
Earth would become a battleground.,地上が戦場になる
Somebody could've told me that the cavalry were here.,誰かが伝えてれば
Hey.,やあ
Tell me about it.,いつでも 相談にのるよ
He escaped into the past.,奴は過去に逃げ込んだ
Collection of fonts and symbols for math mode (AMS),数式モードのためのフォントと記号のコレクション (AMS)
That'll get it done.,そのとおり！
I had to. Get off!,お前はなぜ！
"Please, kill me.",頼む 殺してくれ
It's as... as light as air.,空気みたいに軽いものだ
"You know, I would tell him, because that's what a friend's for.",俺は言いたいな それが友達ってもんだ
Let's go back to when you found your wife's body.,奥さんの死体を見つけた時に 話を戻そう
"But killing is much, much better than working in a grocery shop!",だが 殺しのほうが― 全然！ 稼げる！
Life is as you make it,人生を歩み始め
"The pamphlet’s two authors, Richard Lambert, a formereditor of the Financial Times and future Director General of theConfederation of British Industry, and Nick Butler, the Group VicePresident for Strategy and Policy Development at British Petroleumdo not represent vested academic interests. What they say aboutEurope probably applies to most other parts of the world as well,though not to the United States.",冊子の二人の著者、ファイナンシャル・タイムスの元編集者で、イギリス産業同盟の次期事務局長リチャード・ランバート、そして、BritishPetroleum戦略方針開発グループ副社長ニック・バトラーは、偏った学術的好奇心を代弁しているのではない。彼らのヨーロッパに関する意見は、おそらく世界における他の大部分にも優に当てはまるが、米国はその限りではない。
Lugq?,ルーゴ？
You know what else it is?,他には？
Prices are about to go up again.,物価がまた上がろうとしている。
"- And I love you, but...",- 私だって　でも...
- insight's targets.,- インサイトの目標を。
Good. Then ditch your phone and go do your job.,電話を捨てて 仕事に取り掛かれ
"Nothing, just the wind.",ただの風よ
- Just thinking.,- 考えがある
Bedell is quitting.,ベデルは辞めようとしてる
Will he be able to return to the force?,どこまで元に？
He killed her!,- キム 彼が殺した！
Any change of plans and we'll lose him.,計画の変更は 奴を取り逃がしてしまう
And now you're free and you found me and we can be together.,こうして出会ったんだ 一緒にやるか？
Merry Christmas.,メリークリスマス
I screwed up...,君に対して
"You could talk about things you have in common, like, um, growing up in the '50s.",共通の話題だって あるでしょ ５０年代の話しも出来るしね
"And the dwellers of Madyan (Midian); and belied was Musa (Moses), but I granted respite to the disbelievers for a while, then I seized them, and how (terrible) was My Punishment (against their wrong-doing).",マドヤンの住民も（信じなかった）。またムーサーも拒否された。それでもわれは不信者に猶予を与え，結局かれらに懲罰を与えた。われの拒否はどんなものであったのか。
You?,あなたは
- I don't know. He didn't say.,彼は言わなかった。
"Uh, did they happen to say where they were going?",２人　どこへ行くか言ってたかい？
I love you!,愛してるわ！
- No!,- 違う！
Yeah. We'll see who's laughing next time you need a ticket fixed.,切符を切られても 笑ってるられるかな？
Sorry about this.,ごめんよ！
"You're a genius, and you always have been.",お前は天才だ いつも天才だった
- the wife had no clue what the husband was up to.,夫が何をしてたか 知らなかったと言ってる
- Ten minutes.,- 10分だ
"When the outer layer is hit, the wreckage will continue to drift with us, like a shield. Do it now!",外側がやられたら 残りでカバーし続けるんだ！
I don't wanna burden you with my problems.,負担を掛けたくありません
"Mr. Fujisawa doesn't set a foot outside of his house, spending all the time locked up inside.",藤沢先生 全然　外出してないんですよ。 ずっと　家に 閉じこもってるだけじゃないですか。
We'll find him all right and when we do we'll put him away for life.,無事彼を見つけたら 人生から消えてもらおう
"O, M effing G!",なんて事！
We're gonna go again.,もう一回行きましょ
"Dan Cho-- arrogant little pissant-- no, he didn't work for Canon-Ebersole in 2003, because he had a summer internship with us while he was in business school.",ダン・チョウ 横柄で　つまらない男 彼は　2003年には　キャノン・イベソルで 働いてなかった ビジネス・スクールにいたんだが
Where ?,どこ？
My machines don't make mistakes.,私のマシンは ミスを犯しません
Because Daddy keeps care of the monsters.,パパがモンスターの お話をするから なぜ　ベイビー？
- I just have to go.,- I just have to go.
What a stupid legend. What a waste of my time.,何と時間を無駄にしたことか。
Don't forget it when you call your superiors.,ここで殺したのか？
I'm going to need you and your troupe to vacate the field.,君たち一座には 土地を明け渡してもらいたい
"RJ, where the hell are you?",RJ　一体どこにいる？
The day after my birthday... a man asked me for money.,誕生日の翌日 お金を奪われた
I hear you fought bravely at Highgarden.,ハイガーデンでは勇敢だったそうだな
"Um, my lawyers warned me that this line of questioning might come up,",それに関して質問されるかもしれないと 弁護士には注意されてる
"Some more, some less, but they can. We all can.","{a1pos(113,268)} だが 多かれ少なかれ 誰の傷でも癒える"
-1:00 p.m.,（慎）１時
I'm not old enough to have a kid!,赤ちゃんなんて
But no flipper action.,ひれ足技でなくてね
Boy!,少年！
"Different method, same result.",別の方法　同じ結果
Walk up to the front door?,どうする？ ドァまで歩くか？
I'm just gonna take a listen to your heart.,心臓の音を聴かせてもらうわね
He can't.,彼には出来ない
It's beneath us.,意味無いわよ
"Oh, excuse me, sorry. I didn't mean to scare you there.",失礼 悪かった 脅かすつもりじゃなかったんだ
"Since I became Caesar, I've known four years without war.",皇帝に即位して 平和はわずか４年
How can I get rid of all those fallen leaves?,あの落ち葉をどうやって取り除けようか。
Dang it.,しまった。
I lied to him.,ああ 嘘を言った
Failed to finish project within target time,期間内にプロジェクトを終了できません
Every child bowed to the teacher.,どの子も先生にお辞儀した。
End of line,行末
- That's why I'm going with you.,- ですが私は行きますぞ！
Yeah. Say hi.,うん　挨拶して
(WHISPERING) Frost to fire and fire to frost.,（ささやき声で）氷は炎に、炎は氷に
I'm sorry?,何ですって？
- Eventually? When?,"""何時か"" って何時?"
- That wasn't us.,私たちじゃないわ。
For the historical record... he made it.,話を戻すが― 奴は助かった
"Guys, I definitely smell alien all over this thing.",なあ... 俺は絶対 エイリアンだと思う
Someone packed in a hurry.,誰の為に 私がこんな事を
"Good morning, everyone. Thanks for joining us. I'm Pat Harvey.",おはようございます パット・ハーベイです
Agent Evans.,エバンス捜査官
Sarah died on that coaster.,サラはコースターで死んだ
And who is he?,何者だ？
Jesus Christ is not a weapon.,キリスト様は武器じゃないわよ
Jace! You see anything?,ジェイス 何か見えるか？
Hang on a sec.,ちょっと待ってて
Pulse ox 80. We're dropping!,脈拍80 下がってます！
A who?,誰だって？
- I really don't... - Shh. Name me.,名前をちょうだい
"Well,I meanwe alldie alone, really.",（本当に死んでしまうの？
"Is he safe, Mr. Reese?",彼は安全ですか
Ezekiel sent his detachment out to clear out a building.,エゼキエルが建物の処理に数人送って、
It's just me here.,私はここだ
"Hey, there's not enough room!",ねえ、十分な余地がありません！
Alright?,- よろしく
Okay?,Okay?
Samaritan's AI won't get switched on until Greer gets the government feeds.,サマリア人のAIは スイッチを入れられない グリアが 政府の供給装置を手に入れるまで
"Or do they say, 'He is bedevilled'? Nay, he has brought them the truth, but most of them are averse from the truth.",それで，「かれは(愚?)かれた者である。」と言うのか。そうではない。かれは真理を(湾?)したが，かれらの多くは真理を嫌う。
Bud!,バド！
Are you still mad at us?,まだ怒ってる？
- What are you feasting?,私たちは何を食べている？ 違うよ！
"Go 'head, cuff me.",手錠をかけろ
