en,ja
True that. Serious.,これマジな話だぜ
Come here.,こっちに
Do you know anything about this fire?,火事の事を知ってるか？
Estee Lauder.,エスティローダー
♪ I thought I lost you ♪,私 私はあなたを失った思考
We should've moved you in a while ago.,早く家に入れるべきだった
"""Made from milk protein.""",ミルクタンパク質から作られています
You must be royalty.,王族か
He failed to apologize for betraying our trust.,彼は私たちの信頼を裏切ったことを謝罪しなかった。
"Yeah, I can.",いや 行く
Yeah. Sara Tancredi. That's right.,はい、サラ・テンクレディ 一緒にいるかもしれない
Tokyo was really wonderful.,東京はすばらしかった。
I hung the laundry out to dry last night and by morning it had frozen hard as a rock.,昨日洗濯物を外に干しっぱなしにしたら、朝にはカチンカチンに凍っていた。
_,やってみる
Not with a silencer.,サイレンサーを使わなければね それがあれば・・
"Well, if what I'm about to do goes sideways, the wrong people will figure that out, too.",私のする事が悪化するなら 悪い奴らも見つけ出す
Welcome to the team.,俺たちはチームだ。
Add new profile...,新規プロファイルを追加...
That's a good guess.,その通り
"Thank you for your time, Dr Gideon, I won't waste it. Shall we begin?",面会の機会をどうも 始めても？
Wait. Let's make a deal.,取引をしよう
Sutherland,サザーランドgreat-britain_counties.kgm
Foreman.,ちょっと
Edit Task,タスクを編集
There may be a way.,方法があるだろう
She won't get far with one shoe.,１足の靴では 遠くへ行けない
You were right.,そうね
- if you deviate from my instructions...,- 私の指示によって・・・
They get tested by God.,神により吟味される
"""And let P denote the perimeter of the hexagon.""",Pは 六角形の外郭
"I like scotch, scotch doesn't like me.",俺はスコッチが好きだが、スコッチには 嫌われているようなんでな。
Freeze!,動くな！
- I hope you like the hat.,"− この""胸当て帽""も − その帽子が･･気に入るといいが"
- Like you and Sasha?,- あなたやサーシャみたいに？
"That's, that's the official bill.",それは公文書です
That's how we're built.,それが我々の作り方なんだ
"Now, now.",慌てるな
"Ηis Majesty knew they would keep fighting, so he decided to broadcast his wishes to the people.",陛下は、彼らは暴れ続けるだろうと 承知されていました だから、国民にむかって陛下の思いを 放送で伝えることにしたのです
Ignore him.,無視して。
"He broke them all into pieces, except for the biggest one of them, so that they might return to it [for enquiry].",こうしてかれは，必ずかれらがそこに返って来るであろうと（思って），唯一体の巨像を除きそれらを叩き壊した。
- Have a seat.,- 座って。
"- Mr. Frobisher, I and just a sprinkle of...",フロビシャーさん 上に散らしてたのは...
"Then, what is it?",何なんですか?
He's making a funny face.,この人、笑いをかみ殺してる
Mom.,ママ。
Mr Kato was too old to work any longer.,加藤さんは年をとりすぎてもう働けなかった。
"We found traces of BHT, which is a color preservative.",- ＢＨＴ（ジブチルヒドロキシトルエン） の痕跡を見つけました、 色を保つ防腐剤です。
We're just getting started.,我々はまだ始まったばかりだ
Is this Tak Mashido's greatest creation?,最高の創造物ですか？
Bole of f rk rum.,ラム酒をボウル一杯
"Calm down, Yuri, okay?",落ち着くんだ
Maybe you tried to steal his work?,彼の仕事を盗もうとした
And risk splattering blood and brains over your daughter's fine silk dress?,娘さんの素敵なドレスを 血と脳みそで汚す危険を 冒すので？
♪ Kyle's mom's a bitch She's a big fat bitch ♪,♪カイルのババアはビッチ デブのビッチ♪
- Help me down!,━ 降ろして... ！ ？
- Shit.,- くそっ
"Okay, I don't want to hear anymore, honestly.",正直 何も聞きたくないし
Anything you need.,必要なのは
"And like my Mom says, it's like a sore dick. You can't beat it.",ママもお得っていうぜきっと
You're kind of sexy when you talk all computery.,コンピュータ用語 喋る時 何だか貴方セクシーね
"I could go back, get you some aspirin or something. Yeah.",アスピリンか何か 買ってこようか
"The ones who have believed, emigrated and striven in the cause of Allah with their wealth and their lives are greater in rank in the sight of Allah. And it is those who are the attainers [of success].",信仰する者，移住した者，またアッラーの道のために財産と生命を捧げて奮闘努力した者は，アッラーの御許においては最高の位階にあり，至上の幸福を成就する。
"It was just sublime, Claire.",最高だったわ
"Dad wants us to pick up where he left off -- saving people, hunting things...",親父はやり残した事を 俺達に託したんだ 人助け　狩り
Brian.,ブライアンに任せる
See you in the a.m.?,午前中に会える？
But there's blue and white paint mixed in with the brown.,でも　茶色の中に　青と白が混じってる
Where is the post office?,郵便局はどこですか。
& License Agreement,ライセンス(L)
Can we get this over with so I can go to a goddamn hospital?,早く終わらせて 病院に行かせてくれ
Reference:,リファレンス:
I understand you have reservations.,君は予約されている
Did you hear me?,聞こえてる？
"We are not and if we were,",そんなことはしないし、もしそうだとしたら
Pita with a t for 'too slow'. He knew.,"ピタの ""Ｔ"" だ"
"Now, if you'll excuse me, I've got an after funeral party to attend.",この後の葬式パーティーに 出るから失礼するよ
"We're Whalers, Mr. Ashley.",我々は捕鯨船員だよ アシュリーくん
Old school.,古風ね
A crane collapsed.,クレーンが崩落
I do hope nothing's happened to him.,何か起こったのでなければいいが
I'm wasting my time.,時間の無駄だ
I'm not a kid.,もう子供じゃない！
I don't feel betrayed.,裏切られた気がしない
- and Bauer.,- 聞きました
"- Hey, uh... Anything happen out there today?",今日の体調は？
Folder:,フォルダ:
They want even more of it.,意外 に抵抗 し て い ます
Well done.,よくやった
And a new plan.,新たな計画もな
"She confessed to me that she swallowed them every day, day after day, carrying them around inside of her, as if, someday, she might return to her former grandeur.",彼女はそれを 飲み込んでいたと告白した 毎日　毎日 いつか以前の威厳を 取り戻せるかのように
No.,- 大丈夫さ
"In the dream, I told you I wanted to be with you.",夢では、君といたいと言った
"Yesterday, he called the detective in Pittsburgh who investigated the Kellogg kidnapping.",昨日　故郷の探偵に電話して ケロッグ誘拐の調査を 依頼してるのよ
"I knew her, that's all.",彼女を知っている
Now gimme a beer.,ビールをくれ
"Well, pick me a good fortune cookie, huh?",幸運クッキーを選んでくれ んっ？
Okay.,いいよ。
"Oh, my God!",何と！
All our time.,私たちの時間をね。
Depends on the angle the sleigh hits.,ぶつかる角度によっては
I have someplace... fabulous to go.,僕には　行きたい所があるから
"There are none among the People of the Book but will believe in him before his death, and he will be a witness against them on the Day of Resurrection.",啓典の民の中，かれの死ぬ前にしっかりかれを信じる者は一人もいなかった。審判の日において，かれはかれらにとって（不利な）証人となろう。
You let 'em know I'll be a couple minutes?,"""あと2 3分待て"" と言って来てくれるか"
! It's gonna be okay. It's gonna be okay.,もう大丈夫だ 心配ない
He was responsible for blaming it on the Syrrannites.,彼はシラナイトを批難している張本人だ
How long are you gonna keep him waiting?,どのくらい　彼を 待たせるつもり？
I hooked up my fridge to a little generator and have some beers chilling.,発電機と冷蔵庫を接続して ビールを冷やしたの
"dont run behind success, excellence follow behind excellence success will come all way behind you, who the great scholar told this?",言うじゃないか 成功ではなく 成長のために学べ！ 成功のための勉強じゃない それはすばらしい
It's not real!,現実じゃない
"Oh, well... look on the the bright side.",でもまぁ・・・ 悪いことばかりじゃない
Count,回数
- Totally.,その通り
Are you okay?,[無事なのか？ ]
- It was her big fucking secret!,ー　私にも秘密にしてたのよ!
And we want Miss Lindel's earlier probation violation expunged.,リンデルさんの以前の 保護観察の違反も
"Vietnam witnessed a dramatic fall in poverty, while in Mexico real wages fell. Both countries experienced sharp increases in international trade and foreign investment, but the pictures are utterly different where it counts most: rising standards of living, particularly for the poor.",しかしながらベトナムは、1988 年の経済改革および 1995 年の米国との外交関係の確立を皮切りに、国民一人当たり年率 5.6% で成長してきており、以降も4.5% という高いペースで成長を続けている。ベトナムは貧困へのダイナミックな墜落を経験し、一方メキシコの実質賃金は低下した。両国とも国際貿易および海外投資の急増を経験したが、もっとも重要な点 (特に貧困層の、生活水準の向上) における結果は大きく異なっていた。
I doubt she'Il let you in.,ムリだと思うわ
You're the one that fought me when the Peach Farmers bitched and moaned about me tearing it down. You're the one who took their money.,桃農家から金をもらい お前があれを守った
I'm never coming out!,二度と出ない！
"Come on, rookie.",ついて来な　新入り
I'm going upstairs.,２階を捜索してくる
Do it! Do it!,- やりなさい！
"That's our genius, huh?",彼が博士君か？
"That's what I heard anyway, a long time ago.",大昔に　私が聞いた話だ
Former Special Ops?,元特殊部隊？
And are you a worse scientist because Cam's getting the award?,カムが選ばれたから 順位が落ちたって？
I can't let their wedding be postponed again.,もう２人の式を 延期させたくないの
Due date: %1,締切日付: %1
You'll figure it out. You always do.,お前なら解決するよ いつもだもの
So we're back to square one.,- それじゃ振り出しに戻ったわね
Who has something to gain by trying to fuck with me?,僕に歯向かって 得する奴が誰なのか
- You don't know a Mike?,- 知らないのか？
Here is a letter for you.,あなたに手紙が来ています。
They love me here.,私は愛されてるわよ
"Before we hear from anyone else, I--",次の人の意見を聞く前に
He said that?,そう言ったのか？
You have a deep but not entirely unclouded love for the sea.,海に対して━ 深いが複雑な愛情がある
Let's not count on that. Come on. There's some tools left in the basement.,道具が地下にあったわ 使えそうよ
This is where they test them?,"ここも ""試験所""なのか？"
"You know, I can make things very unpleasant for you.",いいか 不快にする事もできるんだ
You're just a broad I own the joint,"""女達はただの看板"""
Very personal. Who's it to?,そのようね　誰宛なの？
I was happy.,俺は幸せだった
"Yeah, except I'm pretty sure I die in this dream. If I go back into it, am I gonna die in real life?",夢じゃ死ぬけど 本当には死なないよね？
Did they live quietly?,彼らは静かでしたか？
Nothing. No one has seen your brother.,別に　誰も弟を見てないそうだ
"You got a problem with the way I'm running this squad, you talk to Bullard about it, all right?",俺に文句があるなら 大佐に話せ
Sorry.,ごめん
I'm going to get double the advance I got for the last book. Double!,出版権で 前回の二倍もらってやるわ
Feel better?,気分が良くなったか？
My father asked me to bring you to him.,父の言いつけで迎えに来ました
"I..., I told her.",私が言ったんです
"Okay, Cap, get out of there.",キャプテン、とりあえず そこから脱出を
You fucking motherfucker!,この、クソったれめ！
Folder:,フォルダ:
Here!,これだ！
"No, you're right, I don't. Not by you.",ああ　特にお前には
Don't try to be all things to all men.,八方美人になるな。
Leave me alone.,私にかまわないでください。
"It's happening, whether you like it or not.",好みに関わらず 行くんだ
Followed by denial. This is not fortune-telling.,その次には拒絶が...
Almost.,もう少し
I promise..,必ず―
I think great.,すごいんだぞ
Gavar,ガヴァルarmenia.kgm
The machine looks out for me.,マシンは私に気を配ってる
"I'm really proud of you, Sutter. Congratulations.",誇りに思うわ　サター おめでとう
"- Well, that can be arranged.",それなら 今できるわよ
Coulson and I have other matters to attend to.,クールソンと私は別件の調査をする予定よ
You look gorgeous.,すごく綺麗だ
I guess I'm not the only one in the family that's done a 180.,ランス家でやったのは 私だけじゃないと思う
SqueaI bag! SqueaIster!,この密告者！
The army will be routed and put to flight.,やがてこれらの人々は敗れ去り，逃げ去るであろう。
Julia... don't you ever... ever let a man tell you who you are... or make you feel... like you are less than he is.,ジュリア あなたは決して　男に あなたが誰か言わせないでね
What? What'd you learn?,何を調べた?
"Seriously, are you all right?",- 本当に　大丈夫か？
Aurelien Gateau,Aurelien Gateau
Just before I executed him.,私が彼を殺す前にね
"I mean, works in all those zombie movies.",ゾンビ映画は全てそれだ
"Oh, I'm sorry. That must've been...",お気の毒に　さぞかし...
I just want you to know the truth.,...本当の真実を知って欲しい
Why couldn't you spot a simple window dressing like that?,あの程度の粉飾 なぜ見抜けなかったのかね？
"Your country, all mankind, owes you a great deal.",あなたは全人類の命を 背負っている
- Yeah?,-ほんと？
There's another person posing as Matthew Graham.,今、もう一人あなたが居て そいつがFBIを指揮してる
Just because Miss Jeanette ain't real doesn't mean she can't help people.,インチキでも人は救える
EXPENSIVE FEET.,上品な足だよ
Dad!,パパ！
He didn't specify when he would return.,彼はいつ帰るかはっきり言わなかった。
Remember the lace! I simply must have it!,織物忘れないでね！
"Okay, Cody. Fair enough.",わかった　コディ　もういい
He is who he is.,それが彼よ
"- Go go go. - You don't have to do it, you know?",-行 って行　って
- Close by.,近くにいる
There was friction there.,衝突してました
"You do that to me again, and I'll kick your ass!",あなたは、再び私にそれを行うこと と私はあなたのお尻をキックします！
Your own soldiers let me in.,お前自身の兵士に私を加えてくれ
"It's your father, Daimon-kun.",大門君のお父さんです。
"If honor had been your intent, you might have abstained from murdering your brother.",尊敬がお前の意志であるなら 兄を殺したことから 破棄されるだろう
It wasn't me!,俺じゃない！
(Only for LDAP) Enter the base DN for this LDAP server to limit searches to only that subtree of the directory.,LDAP サーバのベース DN を入力して検索をそのディレクトリのサブツリーに限定します (LDAP の場合のみ)。
Or just good aim. You were awake when you fell.,場所も良かった 人目が無くて
Hey!,何だよ。
"Lima, most likely.",休暇で行くならね
And precision. I've made arrangements for you To be received at the building.,疑問点は３つある
We have to go. That fellow keeps staring at us.,行かなけりゃ　奴が追ってくる
Four thousand two hundred thirty-eight.,"4,238"
She has been watching television for three hours.,彼女は３時間テレビを見続けている。
So I shut down a little inside.,だから　私は　少し内にこもったの
I remember seeing the gentleman before.,その紳士には以前あった覚えがある。
"Look, sire !",御覧なさい！
She boasts of her family.,彼女は家族のことを自慢する。
I need you to focus here.,こっちに集中してくれ
Reading:,読み
- When you realize your situation.,現状を知る
I saved your life.,命を救ったのよ
Stop.,やめろ
"""This might ruin our reputation, but that can't be helped.""","""いや これでもう イメージは下がっちゃう"" ""下がっちゃうわけだけど もう それはしかたないし"""
Why is the FBI even interested in them?,なぜＦＢＩが彼らに興味を？
You saved my life again.,あなたは再び私の命を救った
What about your life is so much shittier than the rest of ours that you get to throw in the towel early?,お前がさっさと諦めるほど お前の人生がクソなのはなぜだ？
You know what it means.,それがどんな意味か分かるよな
The empties?,空っぽかな？
Go ahead.,どうぞ
"When Our clear revelations are recited to those who deny the Truth they are wont to say to those who have faith: ""Which of the two groups has a better status and whose assemblies are grander?""",わが公明な印がかれらに読誦される時，信じない者たちは信仰する者に向かって，「どちらが地位において高く，またどちらが気前がいいか」などという。
He's coming after us.,我々の後を追っている
Maybe after.,たぶん後で
"If you're going to work all night, you should try getting some exercise.",朝まで働くなら ちょっとは運動しろ
♪ I am still right here ♪,♪ I am still right here ♪
"And if that happens, he's gonna die.",もしもうそうなったら... 彼は死ぬわ。
"Because I'm afraid, Mr. Bold... that the issue is not whether Vaucan... may represent a threat to the company.",ボールドくん 残念ながら ジャック・ボウカンは もはや 我が社だけの 脅威ではないのだよ
B!,B！
Hurry!,急げ！
You can't have her!,お前には渡さない！
Remove chord,コードを削除
Both of you.,2人とも
Index for Section %1: %2,セクション %1 のインデックス: %2
Frigging psycho.,やめてよ！
Okay. That's the way you wanna play it.,そうか 遊びたいんだな
You've found something?,- 何か見つけたのか？
You are about to see one of the biggest Soviet secrets.,あなたが見るしようとしています 最大のソ連の秘密の一つ。
You didn't mean to kill Hap any more than I meant to kill Kay.,ー　じゃあね ー　じゃあね　フランシス...
- Have you been a good boy today?,今日も頑張った？
This way we'll have a decent conversation.,こちらへどうぞ ちゃんとした会話が出来る
Find Mirri Maz Duur.,ミリ・マゾ・ドロを探して ここに連れて来て
She's female and waiting for you in the cabana.,そうよ！ 女はパーティーに待ってるぞ
"Why don't we stick to good, old-fashioned hand tools for now.",危ないから 置いとこうね
"All right. All right, let's let the games begin. Let's rock 'n' roll.",それじゃあ、ゲーム開始だ レッツ　ロックンロール
"Rigsby, listen to me. Lorelei is going after Lennon.",リグスビー　よく聞いてくれ ローレライは　レノンを追っている
- My ship?,- 私の船？
"She had brain cancer, so everyone thought she was delusional.",脳腫瘍のせいだと みんな思っていた
C'mon. I'll get you home.,家まで送るよ
Be free!,まずい　この量...
- That's not what I meant.,- そういう意味では...
Now what?,どんなヤツだ？
Navigate to this line,この行に移動
As expected?,予想どうりか？
He seemed so helpless.,ぐったりしてて...
That's interesting.,そりゃ興味深い
Ain't nobody worryin'.,♪　誰も嘆いてないわけないじゃない
The police arrested the burglar on the spot.,警官は強盗犯を即座に逮捕しました。
Let's all do our best to not let it happen again.,頑張りましょう （達也）まとめた
I know it's a disappointment.,- がっかりするとは思うけど
You.,君だ
The price of gasoline is so high that we cannot buy a big car.,ガソリンの値段が非常に高いので、我々は大きな車を買うことができません。
- Why don't you bugger off?,-出て行けというのか？
I'm leaving,俺は行くよ
50/50 with you?,半々だよな？
We'll be fine.,私達は大丈夫だ
Our boy just landed.,彼を見つけた
Look at me. I'm alive.,私は生きてるのよ。
"Well, I do have some skill at conkers, if you must know... but I fail to see why that's relevant.",けん玉なら得意ですが でも 争いごとは嫌いなんで
And it is not the word of a poet; little is it that you believe;,これは詩人の言葉ではない。だがあなたがたは，ほとんど信じない。
Why you don't leave the newspaper and do you wash the plates?,新聞置いて お皿洗ったら？
You want your comics? Here.,マンガ　読むだろ？
"Here, take that.",これ はずむよ
"Left rear, there's a utility compartment.",左後方に ユーティリティ・コンパートメントがある
"They want us to open frogs, and I do not know what to do, not surprising.",お前 カエルが怖いんだろ
This love in my heart that I'm feeling for you,このときめきは 君がもたらした
I... I want a quick word with you privately.,僕は　あなたとちょっと内密に話がしたい
I was merely dormant while my body repaired itself.,体を修理しただけだ
Yo.,おい
As fitting stand-ins as we partake of our own last supper.,私達の最後の晩餐には ぴったりだわ
"You time-traveled, okay? Just like I did to come to see you.",タイムトラベルだ 私はお前に会いに来たんだ
"If I am a fool, you are another.",私が馬鹿なら君もそうだ。
What's the harm in letting him have his little fantasy for just a couple more days?,少しくらいの夢を 見させてもいいだろ？
"If they get to it, it's over.",魂の木をやられたら終わりだ
I'm in conference with my client.,依頼人と打ち合わせ中だ
And eunuchs.,そして去勢した宦官
And the fracture on the posterior plane of the sternum?,胸骨の 平面後部の骨折ですか？
This one?,これは？
All right.,すべての権利。
"Ok, you think there is someone else in the miserable woods?",誰がこんなうす暗い森に 来るって言うんだよ？
I got something,材料はある
"Tiger One, we're pushing a drone to your position. - Fuck.",タイガー・ワン ドローンを送る
"- Hey, bro'.",- よお 兄弟
Look at me!,私を見ろ！
"You should know, Captain, I usually cheer the end of any marriage.",僕はね　警部 誰の結婚が終わりを迎えても いつもよくやったと声援を惜しまない
You have to raise funds for the relief work.,君はその救済事業の資金を集めなければならない。
Dad?,パパ？
What she found is already gone.,彼女が見つけたものはもう無くなった。
"So when he investigates the zombie stuff, you feel something. You don't want him to die because they love each other.",それで ゾンビには 死なないとなれない
What's the last city you've been to?,- 最後に住んでいた街は？
"Well, have a safe trip back to Austin.",オースティンまで　気をつけて お帰りください
"Son, where are you?",セム、どこなの？
Do you have any brothers or sisters?,きょうだいはいますか？
- I've been so worried about you.,心配してたの
Don't let this man control you.,挑発に乗るな
That's what I heard.,聞いたことがあるけどな
You shall have the command. Assemble 100 men,命令を下す １００名を率い
You're gonna end this relationship because some lunatic from the future told you that I am destined to marry Barry?,関係を終わらせるつもり？ 未来から来たという狂人に 私とバリーが結婚すると言われて
What is happening?,どうしたの？
"Honey, it' s gonna be too far of a drive for me to come back down here to take you to school in New Jersey every morning.",送り迎え が 大変 だ
Of course.,もちろんさ
"Just let him... Oh, I'm sorry.",# round like a circle in a spiral #
"I have such respect for you, Captain Archer.",あなたを非常に尊敬します、アーチャー船長
- What am I supposed to do with this?,-追跡してくる
It's over.,もう終わりました。
Come and look at this!,ちょっと来てみて
It was transmitted from a cell phone using a Wi-Fi network in the Dupont Circle area.,デュポン サークル周辺で 携帯から送信されてます 持ち主は？
"My name is David, Mrs. Peterson.",僕はデイビッド ピーターソンさん
Ready to earn?,稼ぐ準備は？
"Are you all right, dear?",大丈夫かい？
